// from USB Device Tree Viewer
    =========================== USB Port9 ===========================

Connection Status        : 0x01 (Device is connected)
Port Chain               : 1-9
Properties               : 0x01
 IsUserConnectable       : yes
 PortIsDebugCapable      : no
 PortHasMultiCompanions  : no
 PortConnectorIsTypeC    : no
ConnectionIndex          : 0x09 (Port 9)
CompanionIndex           : 0
 CompanionHubSymLnk      : USB#ROOT_HUB30#4&1995e61&0&0#{f18a0e88-c30c-11d0-8815-00a0c906bed8}
 CompanionPortNumber     : 0x13 (Port 19)
 -> CompanionPortChain   : 1-19

      ========================== Summary =========================
Vendor ID                : 0x303A (Espressif Incorporated)
Product ID               : 0x0002
USB version              : 2.00 -> wrong, device is Full-Speed only
Port maximum Speed       : High-Speed (Companion Port 1-19 supports SuperSpeed)
Device maximum Speed     : Full-Speed
Device Connection Speed  : Full-Speed
Self Powered             : no
Demanded Current         : 500 mA
Used Endpoints           : 3

      ======================== USB Device ========================

        +++++++++++++++++ Device Information ++++++++++++++++++
Device Description       : USB Composite Device
Device Path              : \\?\USB#VID_303A&PID_0002#1234-5678#{a5dcbf10-6530-11d2-901f-00c04fb951ed} (GUID_DEVINTERFACE_USB_DEVICE)
Kernel Name              : \Device\USBPDO-25
Device ID                : USB\VID_303A&PID_0002\1234-5678
Hardware IDs             : USB\VID_303A&PID_0002&REV_0100 USB\VID_303A&PID_0002
Driver KeyName           : {36fc9e60-c465-11cf-8056-444553540000}\0024 (GUID_DEVCLASS_USB)
Driver                   : \SystemRoot\System32\drivers\usbccgp.sys (Version: 10.0.19041.488  Date: 2020-10-08)
Driver Inf               : C:\WINDOWS\inf\usb.inf
Legacy BusType           : PNPBus
Class                    : USB
Class GUID               : {36fc9e60-c465-11cf-8056-444553540000} (GUID_DEVCLASS_USB)
Service                  : usbccgp
Enumerator               : USB
Location Info            : Port_#0009.Hub_#0001
Location IDs             : PCIROOT(0)#PCI(1400)#USBROOT(0)#USB(9), ACPI(_SB_)#ACPI(PCI0)#ACPI(XHC_)#ACPI(RHUB)#ACPI(HS09)
Container ID             : {d19052e6-108c-5707-808c-5d8abd561ffc}
Manufacturer Info        : (Standard USB Host Controller)
Capabilities             : 0x94 (Removable, UniqueID, SurpriseRemovalOK)
Status                   : 0x0180600A (DN_DRIVER_LOADED, DN_STARTED, DN_DISABLEABLE, DN_REMOVABLE, DN_NT_ENUMERATOR, DN_NT_DRIVER)
Problem Code             : 0
Address                  : 9
HcDisableSelectiveSuspend: 0
EnableSelectiveSuspend   : 0
SelectiveSuspendEnabled  : 0
EnhancedPowerMgmtEnabled : 1
IdleInWorkingState       : 0
WakeFromSleepState       : 0
Power State              : D0 (supported: D0, D1, D2, D3, wake from D0, wake from D1, wake from D2)
 Child Device 1          : MIDI class (USB Audio Device)
  Device Path 1          : \\?\USB#VID_303A&PID_0002&MI_01#6&107d6829&0&0001#{65e8773d-8f56-11d0-a3b9-00a0c9223196}\global (AM_KSCATEGORY_CAPTURE)
  Device Path 2          : \\?\USB#VID_303A&PID_0002&MI_01#6&107d6829&0&0001#{65e8773e-8f56-11d0-a3b9-00a0c9223196}\global (AM_KSCATEGORY_RENDER)
  Device Path 3          : \\?\USB#VID_303A&PID_0002&MI_01#6&107d6829&0&0001#{6994ad04-93ef-11d0-a3cc-00a0c9223196}\global (AM_KSCATEGORY_AUDIO)
  Kernel Name            : \Device\000001c4
  Device ID              : USB\VID_303A&PID_0002&MI_01\6&107D6829&0&0001
  Class                  : MEDIA
  Driver KeyName         : {4d36e96c-e325-11ce-bfc1-08002be10318}\0014 (GUID_DEVCLASS_MEDIA)
  Service                : usbaudio
  Location               : 0000.0014.0000.009.000.000.000.000.000
  LocationPaths          : PCIROOT(0)#PCI(1400)#USBROOT(0)#USB(9)#USBMI(1)  ACPI(_SB_)#ACPI(PCI0)#ACPI(XHC_)#ACPI(RHUB)#ACPI(HS09)#USBMI(1)
   Child Device 1        : MIDI class [0] (Generic software device)
    Device ID            : SWD\MMDEVAPI\MIDII_AD54D338.P_0000
    Class                : SoftwareDevice
    Driver KeyName       : {62f9c741-b25a-46ce-b54c-9bccce08b6f2}\0026 (GUID_DEVCLASS_SWD)
   Child Device 2        : MIDI class [1] (Generic software device)
    Device ID            : SWD\MMDEVAPI\MIDII_AD54D338.P_0001
    Class                : SoftwareDevice
    Driver KeyName       : {62f9c741-b25a-46ce-b54c-9bccce08b6f2}\0027 (GUID_DEVCLASS_SWD)

        +++++++++++++++++ Registry USB Flags +++++++++++++++++
HKEY_LOCAL_MACHINE\SYSTEM\CurrentControlSet\Control\usbflags\303A00020100
 osvc                    : REG_BINARY 00 00

        ---------------- Connection Information ---------------
Connection Index         : 0x09 (Port 9)
Connection Status        : 0x01 (DeviceConnected)
Current Config Value     : 0x01 (Configuration 1)
Device Address           : 0x38 (56)
Is Hub                   : 0x00 (no)
Device Bus Speed         : 0x01 (Full-Speed)
Number Of Open Pipes     : 0x02 (2 pipes to data endpoints)
Pipe[0]                  : EndpointID=5  Direction=OUT  ScheduleOffset=0  Type=Bulk
Pipe[1]                  : EndpointID=5  Direction=IN   ScheduleOffset=0  Type=Bulk
Data (HexDump)           : 09 00 00 00 12 01 00 02 00 00 00 40 3A 30 02 00   ...........@:0..
                           00 01 01 02 03 01 01 01 00 38 00 02 00 00 00 01   .........8......
                           00 00 00 09 05 05 02 40 00 00 00 00 00 00 09 05   .......@........
                           85 02 40 00 00 00 00 00 00                        ..@......

        --------------- Connection Information V2 -------------
Connection Index         : 0x09 (9)
Length                   : 0x10 (16 bytes)
SupportedUsbProtocols    : 0x03
 Usb110                  : 1 (yes, port supports USB 1.1)
 Usb200                  : 1 (yes, port supports USB 2.0)
 Usb300                  : 0 (no, port not supports USB 3.0) -> but Companion Port 1-19 does
 ReservedMBZ             : 0x00
Flags                    : 0x00
 DevIsOpAtSsOrHigher     : 0 (Device is not operating at SuperSpeed or higher)
 DevIsSsCapOrHigher      : 0 (Device is not SuperSpeed capable or higher)
 DevIsOpAtSsPlusOrHigher : 0 (Device is not operating at SuperSpeedPlus or higher)
 DevIsSsPlusCapOrHigher  : 0 (Device is not SuperSpeedPlus capable or higher)
 ReservedMBZ             : 0x00
Data (HexDump)           : 09 00 00 00 10 00 00 00 03 00 00 00 00 00 00 00   ................

    ---------------------- Device Descriptor ----------------------
bLength                  : 0x12 (18 bytes)
bDescriptorType          : 0x01 (Device Descriptor)
bcdUSB                   : 0x200 (USB Version 2.00) -> wrong, device is Full-Speed only
bDeviceClass             : 0x00 (defined by the interface descriptors)
bDeviceSubClass          : 0x00
bDeviceProtocol          : 0x00
bMaxPacketSize0          : 0x40 (64 bytes)
idVendor                 : 0x303A (Espressif Incorporated)
idProduct                : 0x0002
bcdDevice                : 0x0100
iManufacturer            : 0x01 (String Descriptor 1)
 Language 0x0409         : "Espressif"
iProduct                 : 0x02 (String Descriptor 2)
 Language 0x0409         : "ESP32S2 arduino device"
iSerialNumber            : 0x03 (String Descriptor 3)
 Language 0x0409         : "1234-5678"
bNumConfigurations       : 0x01 (1 Configuration)
Data (HexDump)           : 12 01 00 02 00 00 00 40 3A 30 02 00 00 01 01 02   .......@:0......
                           03 01                                             ..

    ------------------ Configuration Descriptor -------------------
bLength                  : 0x09 (9 bytes)
bDescriptorType          : 0x02 (Configuration Descriptor)
wTotalLength             : 0x0065 (101 bytes)
bNumInterfaces           : 0x02 (2 Interfaces)
bConfigurationValue      : 0x01 (Configuration 1)
iConfiguration           : 0x00 (No String Descriptor)
bmAttributes             : 0xA0
 D7: Reserved, set 1     : 0x01
 D6: Self Powered        : 0x00 (no)
 D5: Remote Wakeup       : 0x01 (yes)
 D4..0: Reserved, set 0  : 0x00
MaxPower                 : 0xFA (500 mA)
Data (HexDump)           : 09 02 65 00 02 01 00 A0 FA 09 04 01 00 00 01 01   ..e.............
                           00 08 09 24 01 00 01 09 00 01 02 09 04 02 00 02   ...$............
                           01 03 00 00 07 24 01 00 01 25 00 06 24 02 01 01   .....$...%..$...
                           00 06 24 02 02 02 00 09 24 03 01 03 01 02 01 00   ..$.....$.......
                           09 24 03 02 04 01 01 01 00 09 05 05 02 40 00 00   .$...........@..
                           00 00 05 25 01 01 01 09 05 85 02 40 00 00 00 00   ...%.......@....
                           05 25 01 01 03                                    .%...

        ---------------- Interface Descriptor -----------------
bLength                  : 0x09 (9 bytes)
bDescriptorType          : 0x04 (Interface Descriptor)
bInterfaceNumber         : 0x01
bAlternateSetting        : 0x00
bNumEndpoints            : 0x00 (Default Control Pipe only)
bInterfaceClass          : 0x01 (Audio)
bInterfaceSubClass       : 0x01 (Audio Control)
bInterfaceProtocol       : 0x00
iInterface               : 0x08 (String Descriptor 8)
 Language 0x0409         : "midi ino"
Data (HexDump)           : 09 04 01 00 00 01 01 00 08                        .........

        ------ Audio Control Interface Header Descriptor ------
bLength                  : 0x09 (9 bytes)
bDescriptorType          : 0x24 (Audio Interface Descriptor)
bDescriptorSubtype       : 0x01 (Header)
bcdADC                   : 0x0100
wTotalLength             : 0x0009 (9 bytes)
bInCollection            : 0x01
baInterfaceNr[1]         : 0x02
Data (HexDump)           : 09 24 01 00 01 09 00 01 02                        .$.......

        ---------------- Interface Descriptor -----------------
bLength                  : 0x09 (9 bytes)
bDescriptorType          : 0x04 (Interface Descriptor)
bInterfaceNumber         : 0x02
bAlternateSetting        : 0x00
bNumEndpoints            : 0x02 (2 Endpoints)
bInterfaceClass          : 0x01 (Audio)
bInterfaceSubClass       : 0x03 (MIDI Streaming)
bInterfaceProtocol       : 0x00
iInterface               : 0x00 (No String Descriptor)
Data (HexDump)           : 09 04 02 00 02 01 03 00 00                        .........

        - MIDI Adapter Class specific MS Interface Descriptor -
bLength                  : 0x07 (7 bytes)
bDescriptorType          : 0x24 (Class Specific Interface Descriptor)
bDescriptorSubtype       : 0x01 (MS Header)
bcdADC                   : 0x0100
wTotalLength             : 0x0025 (37 bytes)
Data (HexDump)           : 07 24 01 00 01 25 00 06 24 02 01 01 00 06 24 02   .$...%..$.....$.
                           02 02 00 09 24 03 01 03 01 02 01 00 09 24 03 02   ....$........$..
                           04 01 01 01 00                                    .....

        ---------------- MIDI IN Jack Descriptor --------------
bLength                  : 0x06 (6 bytes)
bDescriptorType          : 0x24 (Class Specific Interface Descriptor)
bDescriptorSubtype       : 0x02 (MIDI_IN_JACK)
bJackType                : 0x01 (Embedded)
bJackID                  : 0x01 (ID=1)
iJack                    : 0x00 (No String Descriptor)
Data (HexDump)           : 06 24 02 01 01 00                                 .$....

        ---------------- MIDI IN Jack Descriptor --------------
bLength                  : 0x06 (6 bytes)
bDescriptorType          : 0x24 (Class Specific Interface Descriptor)
bDescriptorSubtype       : 0x02 (MIDI_IN_JACK)
bJackType                : 0x02 (External)
bJackID                  : 0x02 (ID=2)
iJack                    : 0x00 (No String Descriptor)
Data (HexDump)           : 06 24 02 02 02 00                                 .$....

        --------------- MIDI OUT Jack Descriptor --------------
bLength                  : 0x09 (9 bytes)
bDescriptorType          : 0x24 (Class Specific Interface Descriptor)
bDescriptorSubtype       : 0x03 (MIDI_OUT_JACK)
bJackType                : 0x01 (Embedded)
bJackID                  : 0x03 (ID=3)
bNrInputPins             : 0x01 (1 pin)
baSourceID(1)            : 0x02 (input pin connected to entity ID=2)
baSourcePin(1)           : 0x01 (connected to input pin number 1
iJack                    : 0x00 (No String Descriptor)
Data (HexDump)           : 09 24 03 01 03 01 02 01 00                        .$.......

        --------------- MIDI OUT Jack Descriptor --------------
bLength                  : 0x09 (9 bytes)
bDescriptorType          : 0x24 (Class Specific Interface Descriptor)
bDescriptorSubtype       : 0x03 (MIDI_OUT_JACK)
bJackType                : 0x02 (External)
bJackID                  : 0x04 (ID=4)
bNrInputPins             : 0x01 (1 pin)
baSourceID(1)            : 0x01 (input pin connected to entity ID=1)
baSourcePin(1)           : 0x01 (connected to input pin number 1
iJack                    : 0x00 (No String Descriptor)
Data (HexDump)           : 09 24 03 02 04 01 01 01 00                        .$.......

        ----------------- Endpoint Descriptor -----------------
bLength                  : 0x09 (9 bytes)
bDescriptorType          : 0x05 (Endpoint Descriptor)
bEndpointAddress         : 0x05 (Direction=OUT EndpointID=5)
bmAttributes             : 0x02 (TransferType=Bulk)
wMaxPacketSize           : 0x0040 (64 bytes)
bInterval                : 0x00 (0 ms)
bRefresh                 : 0x00
bSynchAddress            : 0x00
Data (HexDump)           : 09 05 05 02 40 00 00 00 00                        ....@....

        --- Class-Specific MS Bulk Data Endpoint Descriptor ---
bLength                  : 0x05 (5 bytes)
bDescriptorType          : 0x25 (Audio Endpoint Descriptor)
bDescriptorSubtype       : 0x01 (MS General)
bNumEmbMIDIJack          : 0x01 (1 embedded MIDI jack)
baAssocJackID(1)         : 0x01 (Jack(1) ID=1)
Data (HexDump)           : 05 25 01 01 01                                    .%...

        ----------------- Endpoint Descriptor -----------------
bLength                  : 0x09 (9 bytes)
bDescriptorType          : 0x05 (Endpoint Descriptor)
bEndpointAddress         : 0x85 (Direction=IN EndpointID=5)
bmAttributes             : 0x02 (TransferType=Bulk)
wMaxPacketSize           : 0x0040 (64 bytes)
bInterval                : 0x00 (0 ms)
bRefresh                 : 0x00
bSynchAddress            : 0x00
Data (HexDump)           : 09 05 85 02 40 00 00 00 00                        ....@....

        --- Class-Specific MS Bulk Data Endpoint Descriptor ---
bLength                  : 0x05 (5 bytes)
bDescriptorType          : 0x25 (Audio Endpoint Descriptor)
bDescriptorSubtype       : 0x01 (MS General)
bNumEmbMIDIJack          : 0x01 (1 embedded MIDI jack)
baAssocJackID(1)         : 0x03 (Jack(1) ID=3)
Data (HexDump)           : 05 25 01 01 03                                    .%...

    ----------------- Device Qualifier Descriptor -----------------
Error                    : ERROR_GEN_FAILURE

      -------------------- String Descriptors -------------------
             ------ String Descriptor 0 ------
bLength                  : 0x04 (4 bytes)
bDescriptorType          : 0x03 (String Descriptor)
Language ID[0]           : 0x0409 (English - United States)
Data (HexDump)           : 04 03 09 04                                       ....
             ------ String Descriptor 1 ------
bLength                  : 0x14 (20 bytes)
bDescriptorType          : 0x03 (String Descriptor)
Language 0x0409          : "Espressif"
Data (HexDump)           : 14 03 45 00 73 00 70 00 72 00 65 00 73 00 73 00   ..E.s.p.r.e.s.s.
                           69 00 66 00                                       i.f.
             ------ String Descriptor 2 ------
bLength                  : 0x2E (46 bytes)
bDescriptorType          : 0x03 (String Descriptor)
Language 0x0409          : "ESP32S2 arduino device"
Data (HexDump)           : 2E 03 45 00 53 00 50 00 33 00 32 00 53 00 32 00   ..E.S.P.3.2.S.2.
                           20 00 61 00 72 00 64 00 75 00 69 00 6E 00 6F 00    .a.r.d.u.i.n.o.
                           20 00 64 00 65 00 76 00 69 00 63 00 65 00          .d.e.v.i.c.e.
             ------ String Descriptor 3 ------
bLength                  : 0x14 (20 bytes)
bDescriptorType          : 0x03 (String Descriptor)
Language 0x0409          : "1234-5678"
Data (HexDump)           : 14 03 31 00 32 00 33 00 34 00 2D 00 35 00 36 00   ..1.2.3.4.-.5.6.
                           37 00 38 00                                       7.8.
             ------ String Descriptor 8 ------
bLength                  : 0x12 (18 bytes)
bDescriptorType          : 0x03 (String Descriptor)
Language 0x0409          : "midi ino"
Data (HexDump)           : 12 03 6D 00 69 00 64 00 69 00 20 00 69 00 6E 00   ..m.i.d.i. .i.n.
                           6F 00                                             o.

